estado,id,oracion
positivo,0,' ( el bigdata ) es una forma que guizhou usó para bajar la pobreza .
positivo,4,"' a la variedad , volumen y veracidad de información que proveemos en el inta , necesitamos sumarle la velocidad , de análisis y transferencia de microsoft para realizar un buen manejo de bigdata ' , afirmó di bella ."
positivo,5,"' a la variedad , volumen y veracidad de información que proveemos en inta , necesitamos sumarle la velocidad , análisis y transferencia de microsoft para realizar un buen manejo de bigdata ' , concluyó el director ."
positivo,6,"' a medida que florezca la industria nacional del internet de las cosas , el bigdata o la experiencia de cliente , habrá una mayor demanda de ese tipo de perfiles ' , opina ."
positivo,10,"' además , esta información también puede ser de utilidad en estudios de mercado , tendencias de búsqueda y otra clase de indicadores estadísticos que estas compañías pueden explotar a través de tecnologías como el bigdata ' ."
negativo,12,"' ahora todo lo que se hace se conoce , todo es ' bigdata ' y uno no quiere que esa información se conozca ; pero los jóvenes , la última generación , se está acostumbrando a eso ."
positivo,13,' al explotar la internet y el bigdata se generó una ultrasegmentación aún mayor .
positivo,14,"' al principio , lo logramos con ingeniería , pero ahora todo es con bigdata porque nuestros usuarios se sacan unas 6 . 000 millones de fotos por día y con esto sabemos lo que quieren ."
positivo,17,"' asociar con microsoft nos permitirá aunar esfuerzos y capacidades en cuestiones relacionadas con minería de datos climáticos e históricos para cálculos de riesgo , o bien la ingeniería de datos satelitales para el seguimiento y análisis de cultivos y los recursos naturales ' , anticipó di bella quien se entusiasma : ' mediante machine learning podremos avanzar en aspectos asociados a los pronósticos meteorológicos y con bigdata profundizaremos la modelización de ciertos sistemas de producción ' ."
positivo,18,"' aunque la región y argentina en particular están especialmente atrasadas en esta materia , la utilización de aplicaciones , bigdata y almacenamiento en la nube permite analizar mejorar el estado general de una organización y tomar mejores decisiones ' , dice el ejecutivo , en diálogo con apertura . com ."
positivo,19,"' bigdata ' : la información infinita || desde el punto de vista tecnológico seguirán apareciendo herramientas que permitirán que el término ' big ' de bigdata sea cada vez mayor , y con menor costo ."
negativo,22,"' cada vez en más tareas los algoritmos superan a los humanos ' , asegura nuria oliver , experta en inteligencia_artificial y de datos ( bigdata ) , en la interacción persona - máquina e informática móvil ."
positivo,23,' cambiamos el producto en base al bigdata para mejorar las ventas .
positivo,26,"' con esta tecnología aprendimos a confiar en los pronósticos ' , disparó marcelo dip , director de la empresa seedmech , refiriéndose a las posibilidades que surgen con el bigdata y la ayuda digital para potenciar la precisión y efectividad en la agricultura moderna ."
positivo,27,"' con herramientas de automatización de aprendizaje ( machine learning ) y opciones embebidas para visualizar ese gran volumen de datos en tiempo real ( bigdata ) , es posible elegir las kpis específicas para monitorear el negocio e inferir relaciones de esos datos ."
positivo,29,"' creo que muchos economistas están entusiasmados con el potencial que ven en el uso de bigdata ' , cuenta trucco a la nacion ."
negativo,30,"' cuando bigdata es más de lo mismo - sigue sosa escudero - , los viejos problemas de la estadística continúan asomando sus espantosas cabezas ."
positivo,32,"' cuando hablamos de bigdata , el principal uso que hacemos es construir productos que la gente quiere para generar comunidad ' , aseguró ."
positivo,33,"' cuando hablamos de la cuarta revolución industrial y pensamos específicamente en el campo nos referimos al cambio de procesos : la inteligencia artificial , bigdata , sensores , machine learning , dejan atrás las libretas de campo en papel y se extienden cada vez más facilitando procesos ' , explicó a infobae ezequiel glinsky , director de proyectos de transformación digital de microsoft argentina ."
positivo,34,"' cuando hablamos de la cuarta revolución industrial y pensamos específicamente en el campo nos referimos al cambio de procesos en el campo , la inteligencia artificial , bigdata , sensores , machine learning , dejan atrás las libretas de campo en papel y se extienden cada vez más facilitando procesos ."
positivo,36,"' de este viaje nos trajimos la experiencia de cómo guizhou logró una gran explotación del bigdata , como forma de potenciar su matriz productiva ."
negativo,39,' desde ciertos sectores del periodismo a las herramientas del bigdata o inteligencia_artificial se las suele ver como amenazas .
positivo,41,' desde la ética podemos crear espacios de reflexión mediante el estudio de casos para incorporar valores en el proceso de utilización y gestión del bigdata y la construcción de algoritmos .
positivo,43,"' disrupción ' fue el término que trajimos de una conferencia de avanzada que delineó los ejes por donde discurren los nuevos desafíos para la producción de alimentos : inteligencia artificial , bigdata , drones , y el adn de las 10 empresas que están revolucionando el agro a nivel mundial ."
positivo,44,"' el ' bigdata ' va a permitir construir política pública en el gobierno de manera mucho más acertada ' , dijo a efe el ministro colombiano de tecnologías de la información y las comunicaciones ( tic ) , diego luna , quien destacó que colombia aspira a convertir en un centro de conexiones en latinoamérica sobre este tema ."
positivo,46,"' el análisis de bigdata , una tarea realizada típicamente en lote por su naturaleza , permite que una organización ordene y analice grandes volúmenes de información estructurada y no estructurada para facilitar la detección de socios y empleados impostores o conjuntos de actividades fraudulentas o abusivas , criminales o conspirativas ' , afirmó avivah litan , analista de gartner ."
positivo,47,"' el año pasado , el cambio más marcado fue la explosión de productos de servicios de bigdata ' , subraya amartino ."
negativo,50,"' el bigdata comienza a afectar cada aspecto de nuestra existencia ' , dice smolan ."
positivo,51,"' el bigdata es muy importarte , ya aprendimos la hoja de ruta del desarrollo en china ' , dijo el gobernador , y agregó que también el cannabis , la zona franca y el parque industrial en perico , ocuparán a decenas de trabajadores ."
positivo,52,' el bigdata es muy útil para el diagnóstico .
positivo,53,"' el bigdata es para estudiar comportamientos , pero no necesariamente existe una invasión a la privacidad de datos personales ' , opinó capobianco ."
positivo,54,' el bigdata es un instrumento psicopolítico muy eficiente que permite adquirir un conocimiento integral de la dinámica inherente a la sociedad de la comunicación .
positivo,55,"' el bigdata es una herramienta para acumular no sólo riquezas si no poder , hoy los datos son el nuevo petróleo , de hecho las capitales financieras del mundo ya no se arman en los puertos como antes , si no donde están los datos ' , insiste jara ."
positivo,56,"' el bigdata hoy se debate en las 3 ' v ' : volumen , velocidad y variedad ' , señaló christian oviedo , gerente de ingeniería de vates al comienzo del encuentro que presenció infonegocios ."
positivo,57,"' el bigdata nos ha ayudado a nosotros y creemos que ayudará también a nuestros clientes en la toma de decisiones , en la gestión más eficiente de los recursos y , en última instancia , en revertir los beneficios de este caudal de información , no solo en sus clientes o usuarios directos , sino también en la sociedad ' , señaló el director del área de datos de telefónica , en cuya unidad se integra luca , chema alonso ."
positivo,58,"' el bigdata pasa por los nuevos usos y perspectivas , no tanto por la información en sí ' , dice ."
positivo,59,' el bigdata permite hacer pronósticos sobre el comportamiento humano .
positivo,60,"' el bigdata significa una gran explosión en la cantidad de datos que se tratan continuamente , pero todos esos datos son inservibles si no se les puede sacar el provecho para obtener conclusiones que se puedan volcar nuevamente al negocio ."
positivo,61,' el bigdata y la inteligencia_artificial sirven para recopilar un montón de información y luego para interpretar esos datos .
positivo,62,"' el concepto de poder predecir el futuro ' tiene mucho que ver con bigdata , porque el análisis de datos obtiene resultados ' ."
positivo,63,"' el dato es el nuevo petróleo ' planteó mauricio rucci de la voz del interior cuando habló sobre ' bigdata : entender lo que no vemos ' , un recorrido por la implementación del ' design thinking ' en el diario ."
positivo,64,"' el desafío es cómo hacer que el bigdata no sea sólo para el mercadeo , sino para mejorar las políticas públicas ' , concluyó ."
positivo,65,"' el intendente quiere transformar a neuquén en una ciudad inteligente y sustentable y esta decisión se vincula con ese propósito , al igual que los estudios que realizamos con bigdata - smart step , la digitalización de los trámites y el plan para cambiar el sistema de iluminación tradicional por led ' , dijo garcía ."
positivo,66,"' el mercadeo puede tomar experiencias de otras industrias como la de la aviación , que fue pionera en usar el bigdata para ser más eficiente - dijo pardo - ."
positivo,70,"' el proyecto de bigdata nos permitió cruzar toda la información de sensores , junto con información no estructurada de redes_sociales y del servicio 147 de call center ."
positivo,71,"' el término en sí es vago , pero está llegando a algo que es real ' , dice jon kleinberg , un especialista en informática de la universidad cornell en ithaca , nueva york . ' bigdata es un rótulo para un proceso que tiene la posibilidad de transformar todo ' ."
negativo,72,"' el uso de bigdata no está cerrada a gobiernos y corporaciones ; grupos criminales anónimos pueden abusar esa información también ' , dice nye ."
positivo,73,' el uso de bigdata produce un acceso más rápido y certero ; el tema es saber cómo las empresas van a aprovechar esos datos para tomar decisiones en forma ágil y adaptar sus procesos velozmente .
positivo,74,"' el volumen de información crece 59% todos los meses , en tanto el valor del bigdata alcanza , solo en reino unido , unos us$ 75 billones ."
positivo,75,"' ellos son bigdata , ambiente y movilidad urbana , modernización el sistema del boleto preferencial , sistema de monitoreo y alerta temprana de calidad del agua ' ."
positivo,77,"' en américa latina estamos transitando la etapa de encuadre y evaluación ' , afirmó keller , y destacó que la adopción de soluciones de bigdata tendrá un impulso gracias a las tecnologías de cloud computing , que permiten contar con infraestructura más elástica ."
negativo,81,' en el universo del bigdata hay también lo que podríamos llamar ricos y pobres de datos .
positivo,82,"' en este universo de datos donde lo dominante es la incertidumbre y la ambigüedad , las herramientas de bigdata y big analytics ( herramientas de procesamiento y análisis de datos masivos ) nos permiten llegar a conclusiones precisas y concretas ' , ha señalado michael karasick , vicepresidente y director del laboratorio ibm research almaden ( estados unidos ) ."
positivo,83,"' en jujuy estamos trabajando en la implementación de bigdata ' , sostuvo morales , que precisó que ' este foro es el más importante de china en dicho campo , y allí vamos a suscribir un acuerdo complementario que permitirá el traslado hasta china , de un equipo provincial argentino , para concurrir al departamento de big data de guizhou , ' y vendrán también expertos chinos a nuestra provincia para ayudar a desarrollar este importante sector en jujuy ' , aseguró morales ."
positivo,84,"' en jujuy estamos trabajando en la implementación de bigdata ; este foro es el más importante de china en dicho campo , y allí vamos a suscribir un acuerdo complementario : va a venir un equipo provincial argentino al departamento de bigdata de guizhou y vendrán también expertos chinos a nuestra provincia para ayudar a desarrollar este importante sector en jujuy ' , sostuvo morales ."
positivo,85,"' en jujuy estamos trabajando en la implementación de bigdata ; este foro es el más importante de china en ese campo , y allí vamos a suscribir un acuerdo complementario : va a venir un equipo provincial argentino al departamento de bigdata de guizhou y vendrán también expertos chinos a nuestra provincia para ayudar a desarrollar este importante sector en jujuy ' , sostuvo morales ."
positivo,87,' en las actividades deportivas este mecanismo se utiliza desde antes de que se llamara bigdata .
positivo,88,"' en las ciudades , la revolución del bigdata pasa por abrir los datos y ponerlos al servicio de la ciudadanía , de los emprendedores , del sector privado , para que con ellos puedan pensar nuevas soluciones que mejoren la calidad de vida ."
positivo,89,"' en latinoamérica grandes industrias como la minería , energía , gas y petróleo ya están usando tecnología que aplica el iiot y el bigdata para lograr convertir sus organizaciones en ' empresas conectadas ' ."
negativo,90,' es algo que sólo se puede hacer con bigdata ' . bigdata tiene sus riesgos .
negativo,91,"' es habitual que el gobierno utilice ' bigdata ' para introducir noticias falsas ' por su parte , el diputado del partido unidad ciudadana , juan cabandié , expresó a rt que la explicación del gobierno de macri sobre el tema es muy escasa : ' la respuesta del ejecutivo fue que tuvieron reuniones con varias empresas , pero no pueden especificar si tuvieron reuniones con cambridge para hacer campañas ' , comentó ."
positivo,96,"' es un orgullo que alta nos elija para hacer su foro de seguridad , aprovechando además la apertura de los datos de aerolíneas argentina que enriquecen la bigdata , el trabajo integrado y permiten trabajar en la planificación de la seguridad que trasciende fronteras y compete a toda la región ' , concluyó ."
positivo,98,"' es un programa - continuó - que aplicando inteligencia_artificial , procesando bigdata , estamos hoy arriba de tres mil niñas , trabajando con niveles de predestinación de cerca del 90% , respecto a posibilidades por marco social , por formación , por núcleo familiar , por lo que sea , que se plantean esas cosas ."
positivo,99,"' es una nueva forma de relacionar con el cliente , aprovechando las capacidades de inteligencia_artificial con el conocimiento del consumo y usos que hacen los clientes de la compañía ' , explicó a infobae , horacio mansilla , director de bigdata de la compañía ."
positivo,100,"' es uno de nuestros pilares estratégicos y apuntamos a crear canales digitales y a transformar las jornadas de nuestros clientes punta a punta en canales físicos y remotos , mientras que a través de bigdata llegamos con ofertas que crean valor y facilitan la vida ' , explica ."
positivo,101,"' esas informaciones de valor para tomar ventajas competitivas es uno de los focos más importantes del bigdata ' , apuntó ."
positivo,102,"' eso sí , dejemos la fantasía de que el bigdata es algo alejado , ajeno a nuestras vidas ' , advierte para los que aún permanecen escépticos ."
negativo,107,"' estamos presenciando un proceso de investigación mundial sobre el uso indebido de bigdata , información personal y redes_sociales con el único objetivo de hacer campañas electorales en distintos países , incluida argentina , orientadas a desprestigiar líderes populares y favorecer gobiernos aliados al sistema financiero planetario ' , sostuvieron ."
positivo,108,' estamos trabajando en la puesta en marcha de un nuevo medio de pago que estamos testeando y tenemos también un proyecto de bigdata para mejorar la experiencia de usuario .
positivo,110,' este año apuntamos a crear una sinergia con el sector académico para realizar estudios con técnicas de bigdata y análisis de un gran volumen de datos de movilidad que recolectamos durante los últimos años con la plataforma .
positivo,116,"' evidentemente , las aplicaciones y los beneficios potenciales de bigdata son amplios ."
positivo,117,' generamos riqueza a partir del bigdata hace 10 años .
positivo,121,"' hacia allí es donde está yendo el mercado ' , dice . - ¿ qué cambios ha notado en los últimos años en los consumidores ? - el comportamiento en los últimos años de los consumidores ha ido cambiando debido a varios motivos , pero sin lugar a dudas el acceso a la tecnología en una pantalla de 7 ' , la necesidad de una mejor experiencia del usuario a la hora de buscar servicios , y la poca importancia de las nuevas generaciones en el sentido de pertenencia , ha generado que las compañías concentren toda su atención en los diferentes canales digitales , en la personalización de los servicios por medio del bigdata , lo cual les permite entender el comportamiento de sus consumidores y así poder anticipar a la demanda de estas nuevas generaciones ."
negativo,123,"' hasta que no se pueda analizar la información , lo que se estará haciendo no es bigdata , es solo almacenamiento ' , apuntó el ejecutivo ."
negativo,125,"' hay mucho que seguir de la nueva regulación europea , por caso , que quienes manejan los tratamientos de datos , sean masivos , sensibles o lo vinculado con bigdata , tengan la obligación de , antes de generar el tratamiento de datos , hacer un estudio de cuál va ser su impacto negativo ' ."
positivo,128,"' hay una empresa que hace análisis de bigdata solo para la moda , es un análisis muy interesante ."
negativo,129,' hay una gran amenaza a la intimidad con el bigdata .
positivo,130,"' hoy la industria del agro está siendo abrazada por el bigdata , y estamos avanzando en ello en todas nuestras líneas de producción ' aseguró franco donatti , gerente de operaciones de la planta ."
negativo,132,"' hoy nos enteramos que se firmó un dnu , un decreto , donde el presidente le transfiere a la jefatura de gabinete todo el manejo tecnológico de todos los datos , de toda la bigdata ' , afirmó cfk ."
negativo,133,"' hoy vemos el deterioro de la intimidad y del cuidado de los datos personales simbolizada a pocos días de las elecciones con un dnu del presidente , donde se remite a la jefatura de gabinete todo lo que podríamos definir como la bigdata de los argentinos ' , expresó cristina kirchner , quien además manifestó que el gobierno se queda con la información que podría ser utilizada para manipular a los argentinos ."
positivo,135,"' integrados a bigdata , tenemos acceso a la audiencia multiplataforma de clarín y , a través de redes_sociales , a la audiencia extendida , donde monitoreamos en tiempo real tendencias y comportamientos de los usuarios ."
negativo,137,"' la aplicación del bigdata supone un cambio disruptivo en este sector pero las decisiones son tomadas en última instancia por personas y , por tanto , podemos volver a repetir errores pasados ' ."
negativo,138,"' la arrogancia del bigdata ' , arrancan , ' es la suposición implícita de que pueden sustituir , en lugar de complementar , a la recopilación de datos y el análisis tradicional ' ."
positivo,139,' la bigdata que genera un sitio como vorterix ayuda en parte a ver cuáles son los comportamientos de los usuarios de ese sitio .
negativo,140,"' la bigdata significa una gran explosión en la cantidad de datos que se tratan continuamente , pero todos esos datos son inservibles si no se les puede sacar el provecho para obtener conclusiones que se puedan volcar nuevamente al negocio ' , evaluó el especialista ."
positivo,145,"' la era del bigdata nos provee una foto de nuestra cultura única en la historia y abre la puerta a preguntas sobre nuestra sociedad ' , dijo ."
positivo,146,' la explosión de datos catalizada por la digitalización del mundo ha puesto al bigdata como una herramienta ineludible para todos los segmentos de la sociedad .
positivo,147,"' la falta de conocimiento es un factor muy limitante para la adopción de bigdata ' , destacó ."
positivo,148,"' la gestión y el análisis de estas cantidades masivas de datos exigen nuevas soluciones que van más allá de los procesos tradicionales o herramientas de software habituales en la práctica diaria , lo que ha llevado a acuñar el termino ' bigdata analytics ' , agregó ."
positivo,149,"' la intención es poder explotar la industria del bigdata en la provincia , es por eso que el próximo mes enviaremos a una comitiva de empresarios para que se capaciten sobre cómo explotar esa industria ' dijo morales ."
positivo,150,"' la policía usa un sistema de evaluación basado en bigdata para determinar si un grupo de personas es sospechoso en función de lo que hace y a dónde va ' , explicó un vocero de la compañía en diálogo con financial times ."
positivo,153,"' la utilización del bigdata y la geolocalización facilita el envío de ofertas a teléfonos móviles a una persona que está en un shopping , por ejemplo ' , comenta luppi ."
positivo,154,"' la utilización del bigdata y la geolocalización facilita el envío de ofertas a teléfonos móviles a una persona que está en un shopping , por ejemplo ' , comentaluppi ."
negativo,155,"' la velocidad y la eficacia de los softwares médicos son una ventaja para profesionales y pacientes para conseguir un diagnóstico más rápido y preciso , pero el riesgo es que se viole la intimidad de las personas o que funcione mal la máquina porque cargamos información incorrecta , entonces será incorrecto el diagnóstico ' , dijo sonia canselier , investigadora de la universidad francesa de nantes , una de las disertantes del coloquio bigdata y salud que se realizó hasta hoy en la universidad católica argentina ."
positivo,156,"' la ventaja es que con el manejo de bigdata , podemos analizar ' , afirman ."
positivo,162,"' las tecnologías que utilizamos para encarar los proyectos de soluciones digitales para la industria 4 . 0 son técnicas aplicables a ‘bigdata’ ( capturar , almacenar y consultar grandes cantidades de datos complejos ) , ‘analytics’ ( para poder interpretar los datos y encontrar patrones representativos ) , ‘análisis predictivo’ ( técnicas de data mining para intentar predecir eventos futuros ) y ‘streaming analysis’ para analizar la información no estructurada y compleja , como videos ."
positivo,163,"' lo importante es tener historias para contar ' aseguró reymondes , que sobre su experiencia relató que ' contamos de manera amplificada cosas que no suelen contar y las vinculamos con la bigdata ' ."
positivo,164,"' lo novedoso del anteproyecto es que cuando se apliquen las técnicas de bigdata o data mining se deberá contar con un funcionario específico que revista el carácter de delegado de protección de datos y , además , se deberá hacer con carácter previo los estudios de riesgos para los datos personales ' , apunta bertoni ."
positivo,165,' lo que está claro es que las soluciones de bigdata son las más activas dentro del sector de it en éste momento .
positivo,166,"' lo que falta en argentina es revertir la cultura empresaria que no está acostumbrada a compartir información , porque utilizar bigdata implica se parte de una cultura colaborativa , que ayuda a crecer a todos ' , aseveró el licenciado en informática ."
positivo,167,"' lo que falta en argentina es revertir la cultura empresaria que no está acostumbrada a compartir información , porque utilizar bigdata implica ser parte de una cultura colaborativa , que ayuda a crecer a todos ' , aseveró el licenciado en informática ."
positivo,168,"' lo que hoy por hoy llamamos ' bigdata ' existía en los años 90 , existía en los años 80 y existía en los años 70 , porque teníamos una infraestructura y teníamos mucha información y cada vez se ha ido generando más información pero ambas han ido evolucionando a la par ' , agregó el experto ."
positivo,171,"' lo que supone el bigdata es la manera en que podemos aprovechar una gran cantidad de información que recolectamos durante años y otra que estamos generando en este momento ' , explicó luque , y afirmó que ' esa cantidad de datos tratada adecuadamente y de manera más o menos sofisticada , permite poder sacar conclusiones para tomar decisiones ' ."
positivo,172,"' logramos desarrollar una tecnología asertiva usando como fuente bigdata y herramientas de muy bajo costo para analizar los datos y llevar al celular de cada encargado ' , dice rafael sánchez , director de desarrollo de negocios de bsg ."
positivo,173,' los cálculos de consultoras especializadas indican que para fines de 2015 se habrán creado más de cuatro millones de empleos relacionados con bigdata y sólo el 30% será cubierto ' .
negativo,174,"' los casos de éxito con el bigdata que se cuentan en los congresos y en los medios muchas veces son lindas historias con más mercadeo que realidad ' , cuenta a la nacion juan damia , ceo de intellignos y representante para américa latina de la digital analytics association para el capítulo bigdata ."
positivo,176,"' los deportes norteamericanos clásicos ( fútbol americano , béisbol y básquetbol ) son los que apostaron a la profesionalización del estudio de estadísticas , inteligencia_artificial y análisis de bigdata para mejorar cada detalle de sus competiciones ."
