estado,id,oracion
negativo,177,"' los pacientes deben saber si su médico utiliza sistemas algorítmicos para hacer diagnósticos y qué tipo de datos usa ' , y a la vez , los profesionales de la salud ' necesitan entender cómo funciona el desarrollo informático que los asiste en sus decisiones ' , dijo sonia canselier , investigadora de la universidad francesa de nantes , una de las disertantes del coloquio bigdata y salud que se realizó hasta ayer en la universidad católica argentina ."
negativo,178,"' los pacientes deben saber si su médico utiliza sistemas algorítmicos para hacer diagnósticos y qué tipo de datos usa ' , y a la vez , los profesionales de la salud ' necesitan entender cómo funciona el desarrollo informático que los asiste en sus decisiones ' , dijo sonia canselier , investigadora de la universidad francesa de nantes , una de las disertantes del coloquio bigdata y salud que se realizó hasta hoy en la universidad católica argentina ."
positivo,179,"' los responsables de las políticas públicas deberían estar implementando políticas destinadas a guiar tendencias como la urbanización , el crecimiento de bigdata y el agrupamiento de personas en pequeñas comunidades , generalmente basado en su relación con el mercado ' , señala ."
positivo,181,"' más que bigdata , hablamos de objetivos de negocios , entendiendo el modelo del cliente y su estrategia : qué hacer con los datos ' , remarca matías varela , data & insights manager en iprospect ."
positivo,182,"' mediante el uso de diferentes aplicaciones se puede mejorar la calidad de los alimentos , obtener información de las condiciones climáticas , el estado del suelo y los cultivos plantados , además de ahorrar recursos naturales durante la producción ' , afirma omar vigetti , bigdata & analytics solution architect lad de oracle ."
positivo,183,"' mediante la bigdata y sus algoritmos de procesamiento , la empresa cada vez sabe más de sus empleados , usuarios y clientes ."
negativo,186,' ningún regulador ha tenido en cuenta que esto es un cambio en cómo concebimos el bigdata y la privacidad .
positivo,187,"' no es casualidad que en el foro económico mundial celebrado en junio en suiza , el concepto de bigdata haya sido protagonista ."
positivo,193,"' nuestras soluciones en los campos de la realidad virtual , robótica , impresoras 3d , drones , iot , computación cognitiva , redes neuronales , bigdata y analytics , son una muestra de cómo practia está transformando el mercado de los servicios de valor agregado basados en la nueva economía digital ' , explica el ejecutivo ."
positivo,194,"' nuestro foco es que nuestros clientes pueden crecer y transformar a través de la tecnología ; el bigdata , inteligencia_artificial y la realidad mixta colaboran en ese objetivo ' , señaló federico garcía , de lagash , compañía que cuenta con 15 años de experiencia en transformar procesos y negocios mediante soluciones tecnológicas ."
negativo,196,' o ' ¿ bigdata : estamos cometiendo un grave error ?
positivo,197,"' otro aspecto del ford smart mobility plan , es la expansión de las capacidades de análisis de datos o ' bigdata ' , que permitirá ofrecer servicios personalizados para los conductores ."
positivo,199,"' para desarrollar o actualizar los programas estamos atentos a las nuevas necesidades que va presentando el mercado , hace tres años por ejemplo fuimos pioneros con la diplomatura en bigdata en lo que se refiere a análisis de grandes volúmenes de datos estructurados y no estructurados , actualmente ya estamos dictando una especialización de esta temática ' , aseveró cortese , del itba ."
positivo,201,"' para lograr estos resultados , los equipos técnicos de la fundación sadosky y el banco hipotecario recurrirán al uso de técnicas basadas en i+d , apelando a novedosas herramientas informáticas y analíticas de ' bigdata ' que permitirán transformar datos en conocimiento mediante un enfoque innovador ."
positivo,203,"' permite cruzar múltiples fuentes de datos para una mejor comprensión y tener visibilidad del escenario completo ' , sostiene varela , que trabajó con soluciones de bigdata en campañas digitales de empresas como general motors ."
positivo,207,"' por otra parte , bigdata permite a los agricultores dar un gigantesco salto tecnológico y aumentar notablemente sus cosechas ."
positivo,208,"' por primera vez en la historia , estamos ofreciendo a los usuarios de ios las prestigiosas herramientas de bigdata y análisis de ibm , lo que abre una gran oportunidad de mercado para apple ."
positivo,209,"' por sí solo el bigdata resulta muy interesante , pero si además se combina con la publicidad se convierte en un mundo apasionante ."
positivo,218,"' se utiliza la tendencia del ' bigdata ' - recopilación y utilización de datos para mejorar el rendimiento empresarial - , de forma que podemos conocer en qué falla y en qué es bueno cada usuario que utiliza el simulador ' , agregó ."
negativo,219,"' según el econometrista , ' como todo remedio nuevo , bigdata viene con letra chica y contraindicaciones , y entenderlas permitirá aprovechar de lo bueno y evitar sus limitaciones ' ."
negativo,221,"' si el gobierno no abre los ojos , no demuestra tener corazón y piensa que puede llevar a los argentinos de la nariz con la bigdata , va a cometer un gran error histórico ."
positivo,224,"' sólo el procesamiento del ‘bigdata’ permitirá atenuar la complejidad de la producción , generada por la enorme variabilidad de factores que interactúan con la tecnología ' , insistió el especialista ."
positivo,226,"' sólo mediante herramientas tales como la ia , el bigdata y machine learning es posible captar y procesar en tiempo real la gran cantidad de datos ' , aseguró ."
positivo,229,' sumado a herramientas de automatización de aprendizaje ( machine learning ) y opciones de herramientas embebidas para visualizar ese gran volumen de datos en tiempo real ( bigdata ) posibilita elegir las kpis específicas para monitorear el negocio e inferir relaciones de esos datos .
positivo,232,"' tanto si utilizan aplicaciones que comparten fotos con millones de usuarios o si necesitan agilizar operaciones claves de la empresa como bases de datos , bigdata o altos niveles de procesamiento , reduciendo costos fijos y gastos de capital , una plataforma de servicios en la nube proporciona acceso rápido y flexible a recursos informáticos de bajo costo ' , amplió ."
positivo,233,"' tecnologías como la inteligencia_artificial y la realidad virtual , junto a la bigdata , ofrecen condiciones óptimas para una cuarta revolución industrial ' , aseguró el informe que marcó también ' el costo de quedar afuera ' de este proceso de evolución tecnológica ."
positivo,235,"' tenemos que aprender de ' los google ' , de los que manejan toda esa gigantesca información ( bigdata ) , para poder sacar conclusiones inteligentes ' , apuntó ."
positivo,236,"' tenemos que aprender de ‘los google’ , de los que manejan toda esa gigantesca información ( bigdata ) , para poder sacar conclusiones inteligentes ' , apuntó ."
positivo,242,"' todos mienten . bigdata , nueva data y todo lo que internet puede contar sobre quiénes somos realmente ' es un libro que analiza las búsquedas más habituales en la web y cómo son estas una ventana para entender la psiquis humana ' desde mi punto de vista parece haber una erosión del deseo sexual tal vez por las oscilaciones de aquel en relación con la vida de pareja ."
positivo,244,"' una ventaja es poder descubrir el rol de cada empleado en las redes internas , y esto es posible detectar gracias a la bigdata , ya que pueden convertir en influencers entre sus compañeros ' , agrega casielles ."
positivo,247,' uno piensa que hacer bigdata es algo casi imposible pero en realidad se puede hacer y gracias a eso se pueden dar soluciones simples para problemas complejos y eso es lo que nosotros buscamos como empresa ' señala lucas olmedo .
positivo,248,"' usando bigdata , por ejemplo , un gerente de recursos humanos puede detectar cuándo una persona valiosa está pensando en dejar la compañía e intentar una solución al problema antes de que sea demasiado tarde ' , ejemplificó verdonek ."
positivo,250,"' y bigdata , con su capacidad de explotar universos de datos de todo tipo , es claramente una potencial fuente de evidencias útiles a los negocios ."
negativo,251,"' y lo de los recursos humanos es cierto : los ceo se llenan la boca hablando de proyectos de bigdata y abren un departamento , pero no están consustanciados con lo que implica , hay muy pocas organizaciones que lo internalizan y están orientadas a hacer un buen uso de las bases de datos ."
negativo,263,"( dpa ) según la especialista en bigdata , laura lanzarini , lo que se publica en facebook ' puede ser utilizada por otras personas ' ."
positivo,266,"( istock ) la secretaría de tecnologías de la información y las comunicaciones , a cargo de héctor huici , creó el observatorio nacional de bigdata con el objeto de analizar la evolución de la tecnología de bigdata en relación a la innovación , beneficios tecnológicos , políticos , económicos y sociales en un marco sustentable ."
positivo,267,"( pedro lázaro fernández ) el jefe de bigdata de clarín aseguró que gracias a la política de brand safety del medio , todos los datos de los usuarios están encriptados y resguardados ."
positivo,282,"|| el bigdata ( grandes datos ) es una de las mayores innovaciones que las empresas y administraciones adoptarán durante los próximos 10 años para mejorar su competitividad , e implica nuevos desarrollos tecnológicos que transformarán profundamente nuestro entorno económico , empresarial y social , según adelantan los científicos de ibm research , una comunidad global de expertos en tendencias tecnológicas ."
positivo,283,"|| el bigdata es aplicable a todo en la vida : análisis de mercadotecnia , eficiencia energética , predicción de consumo , telecomunicaciones o valoraciones de riesgos en la bolsa ."
positivo,291,"|| gracias al bigdata , la medicina comienza un camino que marcará un antes y un después en la atención al paciente ."
positivo,301,"|| según el sitio , la visualización puesta a circular por el grupo ' big picture ' está basado en los análisis de bigdata y procesos de machine learning acerca de los artistas y álbumes que los usuarios de google play music tienen en sus bibliotecas musicales y en datos como la fecha de lanzamiento de los discos ."
positivo,303,"|| una nueva revolución verde || presentaron en inta rafaela un novedoso sistema de alimentación que incluye un carro forrajero innovador , como parte del programa de tecnología de punta que integra robótica , bigdata , sensores y un mapa global de conocimiento en la nube para aumentar la eficiencia alimenticia en tiempo real ."
negativo,304,|| wikileaks reveló documentos sobre la asociación de empresas de bigdata y el estado ruso || la innovación de volver al uno a uno bigdata e inteligencia_artificial son la enorme posibilidad de recuperar y hacer real la promesa de la personalización .
positivo,311,"¿ cómo es que las soluciones de ' bigdata ' , que son aquellas tecnologías capaces de recopilar y analizar grandes volúmenes de información con eficacia , pueden mejorar la toma de decisiones en las corporaciones ?"
negativo,316,"¿ cuáles son las flaquezas del bigdata que muestra este caso y hasta qué punto son representativas de lo que ocurre con otros oráculos basados en grandes cantidades de información social , como ocurre con la capacidad predictiva de twitter ?"
positivo,317,¿ cuáles son los desafíos que plantea el ' bigdata ' a las compañías ? - las empresas se enfrentan al desafío de aprovechar la oportunidad que ofrecen las soluciones bigdata para su negocio .
positivo,318,¿ cuántos puntos le podría aportar a trump intensificar el uso de bigdata ?
positivo,321,¿ esto significa que el manejo de la bigdata se ha convertido en el nuevo dios que todo lo puede ?
positivo,324,¿ podemos apostar al ganador en una carrera de caballos gracias a bigdata ?
negativo,333,"¿ qué pasa con la privacidad en la era del ' bigdata ' , una época en la que cada movimiento realizado queda registrado en alguna parte en el mundo digital ?"
positivo,335,"¿ se debe limitar el bigdata ? – pues sí , el bigdata es una tecnología que se puede usar para el bien o para el mal ."
negativo,337,"¿ se puede pensar que , tras el escándalo en torno a la consultora británica cambridge analytica , se vuelve imposible o en todo caso muy difícil - ganar elecciones sin recurrir al manejo profesional de la llamada bigdata ? - vamos por partes ."
positivo,338,¿ sirve por ejemplo el bigdata para salvar vidas ?
positivo,343,el análisis del bigdata permite generar realidades paralelas según nuestro historial de consumo .
positivo,346," estos dispositivos generan una enorme cantidad de datos , que se almacenan automáticamente en servidores y en la nube , y así , nace el bigdata , que ya tiene ( y tendrá cada vez más ) implicancias directas en nuestra vida , en la salud , la educación , la política , el comercio y las empresas ."
negativo,348, ¿ quieren decir que no fueron seducidos por la sobredimensión que se le dio en el último tiempo al dispositivo comunicacional durán barba - marcos peña - bigdata ?
positivo,351,"° revolución industrial y enfatizan la idea de una creciente digitalización con herramientas como de la inteligencia_artificial , el bigdata y el machine learning ."
positivo,354,"• el factor oferta y demanda de tecnología y servicios de bigdata sigue evolucionando con rapidez , por lo que necesita frecuentes revisiones en la metodología que mide el mercado y en los pronósticos , además de evaluación del mercado competitivo ."
positivo,356,• miles de millones : el gran negocio de bigdata .
positivo,359,"10 - energías eólica y solar inteligentes señalana que la combinación del bigdata ( manejo de grandes cantidades de datos ) y la inteligencia_artificial , provocará que el uso de las energías renovables , como la solar y eólica , se integren mejor en las redes energéticas ."
negativo,380,"a diferencia de una encuesta sistemática ( como una encuesta política o esas que todavía funcionan por teléfonos de línea ) , los datos de bigdata son anárquicos y espontáneos ."
positivo,381,"a diferencia del análisis inductivo , donde el investigador explora en búsqueda de algo determinado y por ende conocido , la exploración de tendencias en bigdata suele mostrar patrones de comportamientos con incidencia real en el desempeño del negocio ."
positivo,385,"a esta situación también hay que sumarle los propios desarrollos que se van realizando en la propia plataforma de internet , y en la incorporación de nuevas tecnologías como ' bigdata ' o ' inteligencia_artificial ' , que ya no son cosas del futuro , sino que están actualmente en funcionamiento , ' y así como tienden a mejorar la experiencia de usuario , también son utilizadas para analizar y predecir el comportamiento de las personas ' , alertó el especialista daniel maldonado ."
negativo,386,"a la hora de la creatividad y la innovación , el bigdata da muchas pistas , pero el pequeño dato se perfila como detonador de disrupciones de mayor impacto ."
positivo,387,"a la luz de todo esto , no existe hoy una empresa de tecnología que despliegue su estrategia de negocio sin contemplar una mirada sobre bigdata ."
positivo,389,"a las 15 : 30 , agustín gimenez , director regional de sociallive , realizará una charla sobre bigdata , una de las tendencias más importantes de los últimos tiempos que no todo el mundo comprende en su totalidad ."
negativo,391,"a las oportunidades que abrieron las tecnologías de bigdata , que muchos ya están aprovechando en ámbitos tan variados como la medicina y las políticas de tránsito urbano , se les contraponen las amenazas de los vacíos legales y la incertidumbre sobre cómo se utilizan los datos que los usuarios dan a diario a las empresas de tecnología ."
negativo,395,"a medida que los análisis de bigdata se imponen en el desarrollo de diversas industrias , la protección de los datos personales de los usuarios de internet gana presencia en esa conversación ."
positivo,397,"a modo de ejemplo , el prestigioso national bureau of economic research americano dio un espacio considerable a la temática de bigdata y algo similar ocurrió con la agenda de todas las reuniones científicas locales ."
positivo,399,"a nivel macro , el bigdata para el desarrollo sostenible trata de reunir , cruzar y relacionar datos procedentes de componentes físicos como incendios , sequías , lluvias , terremotos , etc . con datos sobre componentes sociales como la intensidad lumínica por las casas , llamadas de teléfono , uso del transporte , etc ."
positivo,402,"a partir de ahí , el camino se hace más fácil hasta que la empresa sea capaz de extraer con seguridad todo el valor que un proyecto de ' bigdata ' value le pueda proporcionar ."
positivo,403,"a partir de la bigdata , que son los datos que están en los celulares , nos permitirán saber de qué manera se mueven las personas y pensamos usar principalmente para combatir la inseguridad ' , destacó a lpo el secretario de ambiente y ordenamiento territorial , humberto mingorance ."
positivo,405,"a partir de la bigdata que disponen las grandes empresas de tecnología sobre nosotros , se crean unas categorías personalizadas sobre lo que hacemos en sus entornos virtuales ."
positivo,406,"a partir de la implementación de la ' internet de las cosas ' ( iot , sigla en inglés ) y bigdata , se pueden controlar los drenajes de las ciudades , hasta su sistema de transporte , según explicaron a iprofesional una decena de voceros en el marco de la muestra ."
positivo,407,"a partir de la recolección de bigdata , quieren lograr la detección temprana de enfermedades para la prevención ."
positivo,408,"a partir del análisis masivo de datos del padrón , interacciones de los usuarios en las redes_sociales , utilización de motores de búsqueda en internet , registros de compras en línea y otras decenas de variables , las consultoras dedicadas al bigdata elaboran fórmulas y algoritmos sobre los que construyen ' modelos de votantes ' y preseleccionan segmentos de la población en función de sus probables comportamientos electorales ."
positivo,409,"a partir del análisis masivo de datos sobre el padrón electoral , interacciones de los usuarios en redes_sociales , utilización de motores de búsqueda en internet , registros de compras en línea y otras decenas de variables , las consultoras dedicadas al bigdata elaboran fórmulas y algoritmos sobre los que construyen ' modelos de votantes ' que guían el proselitismo customizado ."
positivo,411,"a partir del entrecruzamiento de información obtenida con bigdata , que entrega datos personales , financieros y de consumo , no se intentaría sólo detectar posibles comportamientos fraudulentos sino también evaluar la lealtad política y el civismo de los chinos ."
negativo,414,"a pesar de presentar al bigdata en su aspecto más positivo y revolucionario para la humanidad , los autores señalan los peligros a los que nos puede conducir una dictadura de los datos ."
positivo,415,"a pesar de que el debate sobre qué es y qué no es bigdata está lejos de terminar , expertos y empresarios concuerdan en que existe un cambio de paradigma , en donde es posible acceder a grandes volúmenes de datos , depurar , analizar y obtener resultados precisos a los problemas de las compañías ."
positivo,416,"a pesar de que todavía hay directivos que no han tomado nota del costo de oportunidad perdido al no apostar por el bigdata , todo apunta a que el boom será inminente , revolucionando en los próximos dos o tres años la forma en que se tratan los datos y se trabaja en analítica de negocios ."
positivo,418,"a quién prestar y cuántoaparte del mecanismo tradicional ( historial crediticio ) , serrano habló con ieco sobre una novedosa metodología que explota lo que se ha venido en conocer como el bigdata ."
positivo,427,"a través de ella y con la ayuda del bigdata y el internet of things , la firma apunta a crear una comunidad global que habla y respira polo en tiempo real ."
positivo,428,"a través de la resolución 11 - e/2017 , publicada en el boletín oficial , se creó un observatorio que tendrá por objeto : ' analizar la evolución de la tecnología de bigdata en materia de posibilidades de innovación , uso público , beneficios tecnológicos , políticos , económicos y sociales en un marco sustentable ' ; ' estudiar el marco regulatorio del uso de datos personales y su relación con el desarrollo y promoción de bigdata ' ; ' promover y crear plataformas públicas seguras y sustentables de bigdata para innovación y nuevas aplicaciones dentro y fuera del estado ' ; ' establecer intercambios con estados provinciales y municipales , pymes , emprendedores y microemprendedores en la implementación y uso de bigdata ' ; ' analizar riesgos y formular normas de buenas prácticas orientadas a un uso sustentable del bigdata ' ; ' articular investigaciones y desarrollos dentro del estado nacional e instituciones académicas , potenciando los recursos locales ' ; ' promover el uso de bigdata en seguridad pública y en la lucha contra el delito ' ; y ' realizar informes , auditorías , compendios de buenas prácticas , propuestas de actualización normativa , plataformas tecnológicas de uso público , entre otras propuestas ' ."
positivo,431,"a través del uso de tecnología y el análisis de bigdata vamos a poder saber en qué zonas de la ciudad y el área metropolitana habrá tormentas fuertes , con una precisión de 4 km y 90 a 120 minutos de antelación ."
positivo,439,"acerca de sus expectativas con este viaje a china y puntualmente la exploración en el campo de ' bigdata ' , el jefe de la misión jujeña describió que ' vamos a interiorizar más sobre esta importante tecnología y las posibilidades de desarrollo , aplicación y radicación en nuestra provincia , veremos los potenciales beneficios para todos los jujeños y en función de eso le acercaremos una propuesta al gobernador para que evalúe ' , concluyó ."
positivo,440,"acompañados del uso de bigdata , para llevar a cabo predicciones de cultivos más precisas , estas nuevas tecnologías comienzan a encontrar su lugar en el sector agropecuario ."
positivo,445,"además , - agregó di bella - mediante machine learning podremos avanzar en aspectos asociados a los pronósticos meteorológicos y con bigdata analytics profundizaremos la modelización de ciertos sistemas de producción ."
positivo,446,"además , –agregó di bella– mediante machine learning podremos avanzar en aspectos asociados a los pronósticos meteorológicos y con bigdata analytics profundizaremos la modelización de ciertos sistemas de producción ."
negativo,450,"además , el acceso indiscriminado a datos personales podría crear también problemas serios a víctimas de violencia o de conflictos , ha dicho , lo que exige garantizar un uso adecuado de todo este potencial del ' bigdata ' , añadió ."
negativo,451,"además , el acceso indiscriminado a datos personales podría crear también problemas serios a víctimas de violencia o de conflictos , lo que exige garantizar un uso adecuado de todo este potencial del ' bigdata ' , añadió ."
negativo,455,"además , el tema de las corporaciones como facebook , levantan información sobre cuestiones afectivas y psicológicas , a través de algoritmos y bigdata ."
positivo,474,"además de los temas antes mencionados , disertará sobre bigdata y redes_sociales ; revolución tecnológica y nuevo modo de administración de las fuerzas productivas para las pymes ; proceso de planificación hacia el paso de la pymes ' anfibias ' y tendencias sobre el mercado local y global ."
positivo,479,además están desarrollando e implementando herramientas que integren los procesos de mercadeo y ventas para el mercado inmobiliario y demás aplicaciones para utilizar el ' bigdata ' de manera inteligente .
positivo,481,"además la detección de otras amenazas normalmente no detectables por la totalidad de los modelos de automóviles : necesidad de alineado , balanceo , recambio de cubiertas por desgaste el caso de mojio es un ejemplo de cómo la tendencia del uso de bigdata se puede aplicar a los autos y de mejorar la forma de usar los vehículos , además de prevenir accidentes , optimizar el rendimiento de los autos que ya están conectados a nuestros smartphones ."
negativo,484,"además remarcaron que se está presenciando un proceso de ' investigación mundial sobre el uso indebido de bigdata , información personal y redes_sociales con el único objetivo de hacer campañas electorales en distintos países , incluida argentina , orientadas a desprestigiar líderes populares y favorecer gobiernos aliados al sistema financiero planetario ' ."
negativo,488,"advirtió también sobre un avance contra ' la intimidad y los datos personales ' a partir del decreto del poder ejecutivo que remite a la jefatura de gabinete la ' bigdata de los argentinos ' , que recoge información de redes_sociales y teléfonos celulares ."
positivo,489,"afirma que las encuestas por sí mismas sólo dan una visión de superficie de las tendencias de opinión y asevera que hay que complementarlas con bigdata , escucha activa en internet y microsegmentación , entre otros métodos ."
positivo,490,"afirman que el universo digital y bigdata están impulsando cambios transformacionales en los ámbitos social , tecnológico , científico y económico ."
